{
  "type": "opsec.verdict",
  "source_event_id": "evt_01HZX9KXXR8QF3T2ABCDEFGHJK",
  "severity": "DANGER",
  "reason": "mimikatz is signatured by all major EDRs and will trigger AMSI/ETW alerts",
  "rule_id": "rule.mimikatz_invocation",
  "suggestions": [
    "Use a custom dumper like nanodump or SafetyKatz",
    "Migrate to an unmonitored process before dumping LSASS"
  ]
}
